{
  "schemaVersion": 1,
  "eventId": "01J9V0S8Q8K3M6ZP4WD5X2N7KL",
  "occurredAt": "2026-08-01T09:16:10.000Z",
  "kind": "metric",
  "severity": "trace",
  "name": "spool.depth",
  "code": "metric.spool.depth",
  "scope": {
    "tenantId": "tenant-local",
    "installationId": "install-0001",
    "runtime": "cli",
    "processId": "cli-11",
    "module": "spool",
    "buildId": "build-2026-08-01-01",
    "appVersion": "0.1.0"
  },
  "correlation": {},
  "privacy": {
    "redactionVersion": "privacy-v1-2026-08-01",
    "capturePolicy": "metadata-only",
    "contentCaptured": false,
    "removedFields": []
  },
  "delivery": {
    "spoolSequence": 12,
    "flushWatermark": 12
  },
  "payload": {
    "message": "spool.depth",
    "metricValue": 128,
    "metricUnit": "events"
  }
}
